{
  "schema_version": "1.0",
  "dataset_version": "synthetic-text-v1",
  "created_on": "2026-10-14",
  "synthetic": true,
  "text_only": true,
  "no_real_audio": true,
  "measurement_status": {
    "asr": "not_measured",
    "diarization": "not_measured",
    "llm": "not_measured"
  },
  "annotation_source": "codex_authored_fixture",
  "human_review_status": "pending",
  "offset_unit": "unicode_code_points",
  "offset_convention": "zero_based_half_open",
  "split": "development_only",
  "warning": "Синтетический текстовый набор для разработки. Нет реального аудио. Не доказывает точность ASR или LLM; отдельный real-audio holdout ещё нужен.",
  "dialogues": [
    {
      "id": "syn_01",
      "title": "КП с абсолютной датой",
      "synthetic": true,
      "text_only": true,
      "no_real_audio": true,
      "usage": "development_fixture",
      "call_at": "2026-10-14T10:00:00+03:00",
      "timezone": "Europe/Minsk",
      "language": "ru",
      "transcript_revision": "r1",
      "participants": [
        {
          "id": "p_manager",
          "display_name": "Ирина",
          "role": "manager",
          "identity_state": "resolved"
        },
        {
          "id": "p_client",
          "display_name": "Павел",
          "role": "client",
          "identity_state": "resolved"
        }
      ],
      "segments": [
        {
          "id": "s1",
          "position": 0,
          "speaker_id": "p_client",
          "participant_id": "p_client",
          "text": "Пришлите коммерческое предложение до 17 октября 2026.",
          "start_ms": null,
          "end_ms": null
        },
        {
          "id": "s2",
          "position": 1,
          "speaker_id": "p_manager",
          "participant_id": "p_manager",
          "text": "Да, отправлю вам КП до 17 октября 2026.",
          "start_ms": null,
          "end_ms": null
        }
      ],
      "tags": [
        "absolute_date",
        "request_acceptance"
      ],
      "gold": {
        "agreements": [
          {
            "id": "g1",
            "action": "Отправить коммерческое предложение",
            "obligor_participant_id": "p_manager",
            "recipient_participant_id": "p_client",
            "due": {
              "kind": "date_only",
              "timezone": "Europe/Minsk",
              "original_text": "до 17 октября 2026",
              "basis_call_at": "2026-10-14T10:00:00+03:00",
              "normalization_source": "fixture",
              "ambiguous": false,
              "ambiguity_reasons": [],
              "date": "2026-10-17"
            },
            "condition": null,
            "eligibility": "candidate",
            "needs_details": [],
            "evidence": [
              {
                "transcript_revision": "r1",
                "segment_id": "s1",
                "start_cp": 0,
                "end_cp": 53,
                "quote": "Пришлите коммерческое предложение до 17 октября 2026.",
                "start_ms": null,
                "end_ms": null
              },
              {
                "transcript_revision": "r1",
                "segment_id": "s2",
                "start_cp": 0,
                "end_cp": 39,
                "quote": "Да, отправлю вам КП до 17 октября 2026.",
                "start_ms": null,
                "end_ms": null
              }
            ]
          }
        ],
        "events": [],
        "key_phrases": [
          {
            "transcript_revision": "r1",
            "segment_id": "s1",
            "start_cp": 0,
            "end_cp": 53,
            "quote": "Пришлите коммерческое предложение до 17 октября 2026.",
            "start_ms": null,
            "end_ms": null
          },
          {
            "transcript_revision": "r1",
            "segment_id": "s2",
            "start_cp": 0,
            "end_cp": 39,
            "quote": "Да, отправлю вам КП до 17 октября 2026.",
            "start_ms": null,
            "end_ms": null
          }
        ],
        "negative_reason": null
      }
    },
    {
      "id": "syn_02",
      "title": "Обязательство без срока",
      "synthetic": true,
      "text_only": true,
      "no_real_audio": true,
      "usage": "development_fixture",
      "call_at": "2026-10-14T10:00:00+03:00",
      "timezone": "Europe/Minsk",
      "language": "ru",
      "transcript_revision": "r1",
      "participants": [
        {
          "id": "p_manager",
          "display_name": "Ирина",
          "role": "manager",
          "identity_state": "resolved"
        },
        {
          "id": "p_client",
          "display_name": "Павел",
          "role": "client",
          "identity_state": "resolved"
        }
      ],
      "segments": [
        {
          "id": "s1",
          "position": 0,
          "speaker_id": "p_client",
          "participant_id": "p_client",
          "text": "Мне нужен прайс.",
          "start_ms": null,
          "end_ms": null
        },
        {
          "id": "s2",
          "position": 1,
          "speaker_id": "p_manager",
          "participant_id": "p_manager",
          "text": "Я отправлю вам актуальный прайс.",
          "start_ms": null,
          "end_ms": null
        }
      ],
      "tags": [
        "unknown_due"
      ],
      "gold": {
        "agreements": [
          {
            "id": "g1",
            "action": "Отправить актуальный прайс",
            "obligor_participant_id": "p_manager",
            "recipient_participant_id": "p_client",
            "due": {
              "kind": "unknown",
              "timezone": "Europe/Minsk",
              "original_text": null,
              "basis_call_at": "2026-10-14T10:00:00+03:00",
              "normalization_source": "fixture",
              "ambiguous": true,
              "ambiguity_reasons": [
                "deadline_not_stated"
              ]
            },
            "condition": null,
            "eligibility": "candidate",
            "needs_details": [
              "due"
            ],
            "evidence": [
              {
                "transcript_revision": "r1",
                "segment_id": "s2",
                "start_cp": 0,
                "end_cp": 32,
                "quote": "Я отправлю вам актуальный прайс.",
                "start_ms": null,
                "end_ms": null
              }
            ]
          }
        ],
        "events": [],
        "key_phrases": [
          {
            "transcript_revision": "r1",
            "segment_id": "s2",
            "start_cp": 0,
            "end_cp": 32,
            "quote": "Я отправлю вам актуальный прайс.",
            "start_ms": null,
            "end_ms": null
          }
        ],
        "negative_reason": null
      }
    },
    {
      "id": "syn_03",
      "title": "Две встречные договорённости",
      "synthetic": true,
      "text_only": true,
      "no_real_audio": true,
      "usage": "development_fixture",
      "call_at": "2026-10-14T10:00:00+03:00",
      "timezone": "Europe/Minsk",
      "language": "ru",
      "transcript_revision": "r1",
      "participants": [
        {
          "id": "p_manager",
          "display_name": "Ирина",
          "role": "manager",
          "identity_state": "resolved"
        },
        {
          "id": "p_client",
          "display_name": "Павел",
          "role": "client",
          "identity_state": "resolved"
        }
      ],
      "segments": [
        {
          "id": "s1",
          "position": 0,
          "speaker_id": "p_manager",
          "participant_id": "p_manager",
          "text": "Я пришлю договор до 16 октября 2026.",
          "start_ms": null,
          "end_ms": null
        },
        {
          "id": "s2",
          "position": 1,
          "speaker_id": "p_client",
          "participant_id": "p_client",
          "text": "А я отправлю реквизиты до 15 октября 2026.",
          "start_ms": null,
          "end_ms": null
        }
      ],
      "tags": [
        "multiple_agreements"
      ],
      "gold": {
        "agreements": [
          {
            "id": "g1",
            "action": "Отправить договор",
            "obligor_participant_id": "p_manager",
            "recipient_participant_id": "p_client",
            "due": {
              "kind": "date_only",
              "timezone": "Europe/Minsk",
              "original_text": "до 16 октября 2026",
              "basis_call_at": "2026-10-14T10:00:00+03:00",
              "normalization_source": "fixture",
              "ambiguous": false,
              "ambiguity_reasons": [],
              "date": "2026-10-16"
            },
            "condition": null,
            "eligibility": "candidate",
            "needs_details": [],
            "evidence": [
              {
                "transcript_revision": "r1",
                "segment_id": "s1",
                "start_cp": 0,
                "end_cp": 36,
                "quote": "Я пришлю договор до 16 октября 2026.",
                "start_ms": null,
                "end_ms": null
              }
            ]
          },
          {
            "id": "g2",
            "action": "Отправить реквизиты",
            "obligor_participant_id": "p_client",
            "recipient_participant_id": "p_manager",
            "due": {
              "kind": "date_only",
              "timezone": "Europe/Minsk",
              "original_text": "до 15 октября 2026",
              "basis_call_at": "2026-10-14T10:00:00+03:00",
              "normalization_source": "fixture",
              "ambiguous": false,
              "ambiguity_reasons": [],
              "date": "2026-10-15"
            },
            "condition": null,
            "eligibility": "candidate",
            "needs_details": [],
            "evidence": [
              {
                "transcript_revision": "r1",
                "segment_id": "s2",
                "start_cp": 0,
                "end_cp": 42,